pref,city,subcity,name,lat,lon
saitama,川口市,川口市,上青木西第２駐車場ステーション,35.82410,139.71515
saitama,川口市,川口市,タイムズ並木第１２ステーション,35.81649,139.70792
saitama,川口市,川口市,エステムコート川口並木ステーション,35.81478,139.70578
saitama,川口市,川口市,タイムズ並木２丁目第２ステーション,35.81436,139.70775
saitama,川口市,川口市,タイムズ並木第１６ステーション,35.81493,139.70753
saitama,川口市,川口市,タイムズ並木第３ステーション,35.81830,139.70437
saitama,川口市,川口市,タイムズ並木第４ステーション,35.81898,139.70531
saitama,川口市,川口市,タイムズ並木第１９ステーション,35.82142,139.70776
saitama,川口市,川口市,アリオ川口,35.80810,139.71404
saitama,川口市,川口市,川口中青木ヤザワパーキング,35.81020,139.71914
saitama,川口市,川口市,タイムズ川口中青木第５,35.81057,139.71814
saitama,川口市,川口市,タイムズ川口中青木第３,35.81549,139.71798
saitama,川口市,川口市,川口元郷駅前第２ステーション,35.80187,139.73030
saitama,川口市,川口市,タイムズ川口元郷駅前,35.80161,139.73046
saitama,川口市,川口市,アートレジデンス・カワグチステーション,35.79766,139.73222
saitama,川口市,川口市,ライオンズスクエア川口（屋上）,35.79705,139.73064
saitama,川口市,川口市,タイムズ川口元郷５丁目,35.80044,139.73777
saitama,川口市,川口市,東川口前野３番月極,35.86695,139.73983
saitama,川口市,川口市,タイムズ南鳩ヶ谷第２ステーション,35.81524,139.73689
saitama,川口市,川口市,加藤月極駐車場,35.81619,139.73432
saitama,川口市,川口市,コンフォール南鳩ヶ谷ステーション,35.81600,139.73332
saitama,川口市,川口市,タイムズ南鳩ヶ谷ステーション,35.81765,139.73470
saitama,川口市,川口市,タイムズ南鳩ヶ谷第４,35.81850,139.73577
saitama,川口市,川口市,タイムズ鳩ヶ谷第５,35.83144,139.73629
saitama,川口市,川口市,タイムズ川口駅西口第４,35.79961,139.71788
saitama,川口市,川口市,タイムズ川口駅西口ステーション,35.79949,139.71683
saitama,川口市,川口市,タイムズ川口５丁目第２,35.80543,139.70859
saitama,川口市,川口市,川口５丁目鈴木駐車場,35.80750,139.71039
saitama,川口市,川口市,タイムズ川口５丁目,35.80470,139.71070
saitama,川口市,川口市,タイムズ川口幸町第７,35.80604,139.72106
saitama,川口市,川口市,ラ・フルーラ・メゾン川口ステーション,35.80596,139.72071
saitama,川口市,川口市,川口幸町月極,35.80655,139.71896
saitama,川口市,川口市,幸町中村駐車場,35.80738,139.71870
saitama,川口市,川口市,タイムズ川口第４,35.80584,139.71458
saitama,川口市,川口市,タイムズ川口第３,35.80563,139.71481
saitama,川口市,川口市,タイムズ川口幸町第５,35.80632,139.71747
saitama,川口市,川口市,パレットタウン東川口,35.87411,139.74363
saitama,川口市,川口市,ロイヤルメゾン４,35.87061,139.74353
saitama,川口市,川口市,東川口前野７番月極,35.87110,139.74249
saitama,川口市,川口市,タイムズ東川口第２ステーション,35.87326,139.74833
saitama,川口市,川口市,ロイヤルメゾン１,35.87401,139.74732
saitama,川口市,川口市,デュオヒルズ東川口ステーション,35.87494,139.74719
saitama,川口市,川口市,新井宿駅前第６月極,35.84351,139.73852
saitama,川口市,川口市,川口本町一丁目大熊駐車場,35.79478,139.72566
saitama,川口市,川口市,リフェスト第６,35.79598,139.72591
saitama,川口市,川口市,川口本町２－９月極,35.79866,139.72657
saitama,川口市,川口市,タイムズ川口本町第４,35.79994,139.72297
saitama,川口市,川口市,タイムズ川口本町第５,35.80041,139.71939
saitama,川口市,川口市,ＴＳレジデンス東川口ステーション,35.87655,139.74270
saitama,川口市,川口市,早水月極,35.80345,139.72466
saitama,川口市,川口市,タイムズ川口栄町第４ステーション,35.80234,139.72437
saitama,川口市,川口市,川口栄町３丁目駐車場,35.80430,139.72094
saitama,川口市,川口市,タイムズ川口栄町,35.80403,139.72039
saitama,川口市,川口市,タイムズ川口芝２丁目ステーション,35.83319,139.69579
saitama,川口市,川口市,タイムズ川口芝４丁目ステーション,35.83248,139.69547
saitama,川口市,川口市,タイムズ川口芝５丁目ステーション,35.83190,139.69580
saitama,川口市,川口市,タイムズ川口芝宮根第２,35.84019,139.69631
saitama,川口市,川口市,タイムズ川口芝新町第３ステーション,35.82938,139.69413
saitama,川口市,川口市,タイムズ川口芝新町ステーション,35.82973,139.69330
saitama,川口市,川口市,タイムズ川口芝樋ノ爪ステーション,35.83224,139.68810
saitama,川口市,川口市,タイムズ川口芝西１丁目,35.83417,139.68539
saitama,川口市,川口市,タイムズ西川口西口ステーション,35.81675,139.70219
saitama,川口市,川口市,タイムズ西川口１丁目第６ステーション,35.81408,139.70060
saitama,川口市,川口市,タイムズ西川口１丁目第７ステーション,35.81506,139.69996
saitama,川口市,川口市,タイムズ西川口２丁目第２ステーション,35.81323,139.70053
saitama,川口市,川口市,タイムズ西川口６丁目,35.80966,139.70190
saitama,川口市,川口市,タイムズ戸塚安行第２ステーション,35.85763,139.75399
saitama,川口市,川口市,タイムズ戸塚安行第３ステーション,35.85801,139.75229
saitama,川口市,川口市,タイムズ川口西青木２丁目,35.81577,139.71476
saitama,川口市,川口市,タイムズ川口西青木第２ステーション,35.81692,139.71254
saitama,川口市,川口市,タイムズ川口西青木第３,35.81986,139.71538
saitama,川口市,川口市,タイムズ川口西青木ステーション,35.81779,139.71255
saitama,川口市,川口市,タイムズ川口西青木５丁目ステーション,35.82325,139.71524
saitama,川口市,川口市,タイムズ鳩ヶ谷第４ステーション,35.83201,139.73299
saitama,川口市,川口市,ラ・ルミエール,35.79868,139.72192
saitama,川口市,川口市,タイムズ戸塚安行,35.85887,139.75504
saitama,川口市,川口市,川口リジョイス青木第２,35.80767,139.72525
saitama,川口市,川口市,川口青木３丁目駐車場,35.81127,139.72775
saitama,川口市,川口市,川口飯塚月極,35.80036,139.71410
saitama,川口市,川口市,タイムズ鳩ヶ谷本町ステーション,35.83356,139.73995
saitama,川口市,川口市,タイムズ鳩ヶ谷本町第２,35.83262,139.74006
saitama,越谷市,越谷市,ソレアードＬ・Ｔステーション,35.87420,139.82246
saitama,越谷市,越谷市,ヴェルドミールＫステーション,35.87545,139.82119
saitama,越谷市,越谷市,タイムズ越谷レイクタウン駅前第３,35.87596,139.82337
saitama,越谷市,越谷市,レイクサイドパーキング,35.87857,139.82287
saitama,越谷市,越谷市,レイクタウン駅前月極,35.87742,139.82307
saitama,越谷市,越谷市,七左パーキング,35.86983,139.78150
saitama,越谷市,越谷市,タイムズ北越谷第４ステーション,35.90317,139.77713
saitama,越谷市,越谷市,タイムズせんげん台駅東口第２ステーション,35.93518,139.77696
saitama,越谷市,越谷市,タイムズせんげん台第２ステーション,35.93590,139.77181
saitama,越谷市,越谷市,タイムズせんげん台第６,35.93465,139.77171
saitama,越谷市,越谷市,タイムズせんげん台第５ステーション,35.93377,139.77214
saitama,越谷市,越谷市,アンセラジオ新越谷ステーション,35.87473,139.79127
saitama,越谷市,越谷市,タイムズ南越谷第５ステーション,35.87325,139.79297
saitama,越谷市,越谷市,ファミリーマート南越谷一丁目南店,35.86995,139.79107
saitama,越谷市,越谷市,タイムズ南越谷第８ステーション,35.87841,139.78904
saitama,越谷市,越谷市,新越谷駅前,35.87665,139.78929
saitama,越谷市,越谷市,タイムズ南越谷３丁目ステーション,35.87848,139.78572
saitama,越谷市,越谷市,南越谷３丁目,35.87856,139.78548
saitama,越谷市,越谷市,南越谷４丁目,35.87334,139.79004
saitama,越谷市,越谷市,タイムズ南越谷第３,35.87274,139.79023
saitama,越谷市,越谷市,タイムズ北越谷第３ステーション,35.90581,139.78118
saitama,越谷市,越谷市,タイムズ越谷瓦曽根ステーション,35.88549,139.78840
saitama,越谷市,越谷市,リジェール,35.86940,139.79152
saitama,越谷市,越谷市,タイムズ蒲生寿町ステーション,35.86790,139.79599
saitama,越谷市,越谷市,リブリ・クオーレステーション,35.86829,139.79083
saitama,越谷市,越谷市,タイムズ蒲生西町,35.86505,139.79420
saitama,越谷市,越谷市,タイムズ大袋第２,35.92299,139.77925
saitama,越谷市,越谷市,タイムズ大袋駅前ステーション,35.92310,139.77758
saitama,越谷市,越谷市,タイムズ越谷駅西口第３ステーション,35.88911,139.78531
saitama,越谷市,越谷市,越谷駅船川駐車場,35.88509,139.78529
saitama,越谷市,越谷市,タイムズ越谷駅西口第５ステーション,35.88657,139.78501
saitama,越谷市,越谷市,サイプレスの森,35.88676,139.78476
saitama,越谷市,越谷市,Ｓｔｉｌｌｅ越谷,35.88883,139.78378
saitama,戸田市,戸田市,ラグゼナ戸田公園,35.81250,139.68132
saitama,戸田市,戸田市,タイムズ下戸田１丁目,35.81214,139.68471
saitama,戸田市,戸田市,タイムズ戸田中町ステーション,35.81159,139.69350
saitama,戸田市,戸田市,プレミスト戸田公園ステーション,35.80946,139.68805
saitama,戸田市,戸田市,タイムズ戸田喜沢第２ステーション,35.81394,139.69816
saitama,戸田市,戸田市,タイムズ戸田喜沢南ステーション,35.80593,139.69191
saitama,戸田市,戸田市,ルートストアハブ戸田駅前,35.81933,139.67139
saitama,戸田市,戸田市,タイムズ北戸田第２ステーション,35.82662,139.66521
saitama,戸田市,戸田市,Ｔ－ＦＲＯＮＴＥステーション,35.81745,139.66839
saitama,戸田市,戸田市,タイムズ戸田駅前,35.81649,139.67074
saitama,戸田市,戸田市,タイムズ戸田新曽南ステーション,35.80781,139.66285
saitama,戸田市,戸田市,戸田公園駅前第３ステーション,35.80897,139.68077
saitama,戸田市,戸田市,タイムズ戸田公園駅前第２,35.80830,139.68050
saitama,戸田市,戸田市,戸田公園東口駅前,35.80867,139.67984
saitama,戸田市,戸田市,タイムズ戸田本町第４,35.81142,139.68257
saitama,戸田市,戸田市,タイムズ戸田本町ステーション,35.80946,139.68286
saitama,戸田市,戸田市,タイムズ戸田本町（駅前）,35.80939,139.68232
saitama,戸田市,戸田市,戸田公園西口駅前ステーション,35.80743,139.67620
saitama,戸田市,戸田市,タイムズ戸田公園駅前第５ステーション,35.80648,139.68194
saitama,戸田市,戸田市,タイムズ彩香の湯第２ステーション,35.81101,139.66173
saitama,戸田市,戸田市,タイムズ笹目２丁目ステーション,35.81334,139.65305
saitama,戸田市,戸田市,タイムズ美女木１丁目ステーション,35.82972,139.63905
saitama,草加市,草加市,タイムズ草加住吉第４ステーション,35.82979,139.80562
saitama,草加市,草加市,草加駅前一番通り,35.82986,139.80539
saitama,草加市,草加市,タイムズ草加住吉第３ステーション,35.83016,139.80419
saitama,草加市,草加市,タイムズ草加住吉第８,35.82972,139.80937
saitama,草加市,草加市,タイムズ草加弁天ステーション,35.84148,139.81320
saitama,草加市,草加市,グランヴィラージュ駐車場,35.80929,139.78320
saitama,草加市,草加市,タイムズ草加旭町第２ステーション,35.84978,139.79344
saitama,草加市,草加市,ＵＲハーモネスタワー松原ステーション,35.84239,139.79962
saitama,草加市,草加市,タイムズコンフォール松原団地ステーション,35.84220,139.79805
saitama,草加市,草加市,タイムズ草加松江ステーション,35.84497,139.80664
saitama,草加市,草加市,タイムズ草加氷川町第２６ステーション,35.82789,139.79939
saitama,草加市,草加市,フレアコート草加,35.82792,139.80283
saitama,草加市,草加市,タイムズ草加氷川町第２４ステーション,35.82789,139.80210
saitama,草加市,草加市,タイムズ草加氷川町第１１ステーション,35.83024,139.80195
saitama,草加市,草加市,タイムズ谷塚駅前第４ステーション,35.81612,139.80260
saitama,草加市,草加市,ＵＲグリーンアベニュー谷塚ステーション,35.81551,139.80053
saitama,草加市,草加市,新田駅高架下第２,35.85529,139.79496
saitama,草加市,草加市,タイムズ草加高砂第４ステーション,35.82648,139.80549
saitama,所沢市,所沢市,グランエミオ所沢４Ｆ,35.78670,139.47396
saitama,所沢市,所沢市,タイムズ所沢ステーション,35.78821,139.47509
saitama,所沢市,所沢市,タイムズ所沢第２ステーション,35.78820,139.47650
saitama,所沢市,所沢市,タイムズマンスリー所沢くすのき台,35.78877,139.48033
saitama,所沢市,所沢市,タイムズくすのき台第３,35.78757,139.47665
saitama,所沢市,所沢市,タイムズ所沢けやき台,35.79971,139.45570
saitama,所沢市,所沢市,タイムズ北所沢町,35.81028,139.45477
saitama,所沢市,所沢市,タイムズ航空公園駅西口第２ステーション,35.79975,139.46384
saitama,所沢市,所沢市,イニシア所沢ステーション,35.79170,139.46716
saitama,所沢市,所沢市,タイムズ小手指第３ステーション,35.80379,139.43808
saitama,所沢市,所沢市,タイムズ小手指第５,35.80505,139.44019
saitama,所沢市,所沢市,タイムズ所沢御幸町第２,35.79185,139.47057
saitama,所沢市,所沢市,タイムズ所沢旭町ステーション,35.79118,139.47587
saitama,所沢市,所沢市,セクール所沢,35.78651,139.46947
saitama,所沢市,所沢市,タイムズ東所沢第３ステーション,35.79416,139.51474
saitama,所沢市,所沢市,タイムズ東所沢駅前第２ステーション,35.79337,139.51353
saitama,所沢市,所沢市,タイムズ東所沢駅前,35.79419,139.51361
saitama,所沢市,所沢市,タイムズ東所沢駅前第３,35.79328,139.51350
saitama,所沢市,所沢市,タイムズ東所沢第４ステーション,35.79274,139.51221
saitama,所沢市,所沢市,タイムズ東所沢第６,35.79529,139.51226
saitama,所沢市,所沢市,タイムズ東所沢第５,35.79607,139.51110
saitama,所沢市,所沢市,ピュアメゾン,35.79585,139.51100
saitama,所沢市,所沢市,タイムズ狭山ヶ丘第２ステーション,35.81112,139.41857
saitama,所沢市,所沢市,タイムズ新所沢駅前,35.80686,139.45453
saitama,所沢市,所沢市,新所沢駅西口第１ステーション,35.80523,139.45717
saitama,所沢市,所沢市,ＵＲプラザシティ新所沢けやき通り,35.80414,139.45450
saitama,所沢市,所沢市,タイムズ新所沢第７ステーション,35.80365,139.45537
saitama,所沢市,所沢市,タイムズ所沢緑町,35.80007,139.45004
saitama,所沢市,所沢市,タイムズ新所沢第３ステーション,35.80749,139.45402
saitama,所沢市,所沢市,西所沢並木駐車場,35.78910,139.45769
saitama,所沢市,所沢市,タイムズ西所沢ステーション,35.78937,139.45823
saitama,所沢市,所沢市,タイムズ所沢金山町第２ステーション,35.79152,139.46282
saitama,所沢市,所沢市,タイムズ所沢金山町,35.79158,139.46215
saitama,川越市,川越市,タイムズ川越中原町第５,35.91660,139.48116
saitama,川越市,川越市,川越仙波ＳＳパーキング,35.91108,139.48932
saitama,川越市,川越市,タイムズ川越仲町第３ステーション,35.92095,139.48188
saitama,川越市,川越市,タイムズ南大塚第２（川越）ステーション,35.89091,139.45436
saitama,川越市,川越市,タイムズ南大塚駅北口,35.89133,139.45260
saitama,川越市,川越市,川越小野澤駐車場３,35.90961,139.48645
saitama,川越市,川越市,タイムズ霞ヶ関第２ステーション,35.92658,139.44256
saitama,川越市,川越市,タイムズ川越新宿町第２,35.90400,139.48508
saitama,川越市,川越市,タイムズ川越新宿町第３,35.90247,139.48406
saitama,川越市,川越市,タイムズ青梅信用金庫川越支店ステーション,35.90196,139.47706
saitama,川越市,川越市,西武本川越ステーション,35.91436,139.48132
saitama,川越市,川越市,タイムズ川越新富町ステーション,35.91245,139.48158
saitama,川越市,川越市,ルネスアーデル,35.91185,139.48193
saitama,川越市,川越市,タイムズ川越松江町第２ステーション,35.91984,139.48450
saitama,川越市,川越市,タイムズ川越松江町ステーション,35.92160,139.48506
saitama,川越市,川越市,タイムズ川越脇田本町第６,35.90676,139.48082
saitama,川越市,川越市,タイムズ川越駅西口第３ステーション,35.90810,139.48179
saitama,川越市,川越市,タイムズ川越脇田本町第３（ＥＶ）,35.90586,139.48248
saitama,川越市,川越市,タイムズ川越脇田本町第３,35.90582,139.48253
saitama,川越市,川越市,タイムズ川越脇田本町第５,35.90696,139.47714
saitama,川越市,川越市,タイムズ川越脇田本町,35.90475,139.48154
saitama,川越市,川越市,タイムズ川越脇田町,35.91063,139.48245
saitama,川越市,川越市,タイムズ川越脇田町第３ステーション,35.91014,139.48090
saitama,川越市,川越市,タイムズ川越菅原町,35.90545,139.48683
saitama,川越市,川越市,川越駅東口ノ・メールマサキステーション,35.90786,139.48672
saitama,川越市,川越市,タイムズ川越菅原町第２,35.90601,139.48596
saitama,川越市,川越市,タイムズ川越西小仙波町ステーション,35.91664,139.48732
saitama,川越市,川越市,タイムズ川越連雀町第２ステーション,35.91815,139.48225
saitama,川越市,川越市,タイムズ鶴ヶ島第２ステーション,35.93618,139.42273
saitama,朝霞市,朝霞市,タイムズ志木駅南口ステーション,35.81872,139.57674
saitama,朝霞市,朝霞市,志木駅南口（カーシェア時間帯限定）,35.81876,139.57666
saitama,朝霞市,朝霞市,タイムズ志木駅南口第２ステーション,35.81635,139.57807
saitama,朝霞市,朝霞市,タイムズ志木駅南口第３ステーション,35.82054,139.57744
saitama,朝霞市,朝霞市,細野第二駐車場ステーション,35.81874,139.58885
saitama,朝霞市,朝霞市,朝霞金子第一ステーション,35.79663,139.59625
saitama,朝霞市,朝霞市,セジュール朝霞,35.79500,139.59819
saitama,朝霞市,朝霞市,きゅうちゃんパーキング,35.81311,139.58587
saitama,朝霞市,朝霞市,朝霞台ヴィルドミールステーション,35.81257,139.58684
saitama,朝霞市,朝霞市,タイムズ朝霞自衛隊前ステーション,35.78561,139.60062
saitama,朝霞市,朝霞市,あさかリードタウン,35.80869,139.60853
saitama,朝霞市,朝霞市,ハイムスイート朝霞,35.81023,139.60861
saitama,朝霞市,朝霞市,タイムズ北朝霞ステーション,35.81590,139.58817
saitama,朝霞市,朝霞市,タイムズ朝霞溝沼,35.81092,139.59482
saitama,朝霞市,朝霞市,タイムズ朝霞台第５ステーション,35.81693,139.58776
saitama,朝霞市,朝霞市,タイムズ北朝霞第２ステーション,35.81667,139.58837
saitama,朝霞市,朝霞市,西弁財パーキング,35.81483,139.58586
saitama,朝霞市,朝霞市,タイムズ朝霞西弁財１丁目第２,35.81405,139.58338
saitama,朝霞市,朝霞市,タイムズ朝霞西弁財１丁目ステーション,35.81508,139.58402
saitama,春日部市,春日部市,タイムズ春日部中央第９ステーション,35.98011,139.75128
saitama,春日部市,春日部市,春日部中央第１５,35.97866,139.74933
saitama,春日部市,春日部市,タイムズ春日部中央第２ステーション,35.97768,139.74903
saitama,春日部市,春日部市,タイムズ春日部中央１丁目,35.97893,139.75161
saitama,春日部市,春日部市,タイムズ春日部中央第４ステーション,35.97686,139.75283
saitama,春日部市,春日部市,タイムズ春日部中央第１３ステーション,35.97608,139.75242
saitama,春日部市,春日部市,タイムズ春日部中央第７ステーション,35.97784,139.75091
saitama,春日部市,春日部市,タイムズ春日部駅西口ステーション,35.97828,139.75033
saitama,春日部市,春日部市,タイムズ武里駅前ステーション,35.94816,139.77135
saitama,春日部市,春日部市,タイムズ春日部駅東口第５ステーション,35.98137,139.75123
saitama,春日部市,春日部市,タイムズ春日部駅東口第６,35.98189,139.75212
saitama,春日部市,春日部市,タイムズ春日部第６ステーション,35.97908,139.74637
saitama,春日部市,春日部市,タイムズ春日部駅東口第３ステーション,35.98053,139.75621
saitama,春日部市,春日部市,タイムズ匠大塚春日部本店ステーション,35.98149,139.75824
saitama,春日部市,春日部市,春日部,35.96868,139.74557
saitama,熊谷市,熊谷市,タイムズ熊谷中西第２,36.14864,139.39452
saitama,熊谷市,熊谷市,タイムズ熊谷宮前町第２ステーション,36.13882,139.38691
saitama,熊谷市,熊谷市,タイムズ熊谷宮前町ステーション,36.14023,139.38709
saitama,熊谷市,熊谷市,タイムズ熊谷星川第５,36.14271,139.38753
saitama,熊谷市,熊谷市,タイムズ熊谷駅南口,36.13768,139.39176
saitama,熊谷市,熊谷市,竹内駐車場ステーション,36.13784,139.39149
saitama,熊谷市,熊谷市,タイムズ熊谷末広,36.14605,139.39178
saitama,熊谷市,熊谷市,タイムズ熊谷筑波第９,36.14233,139.38876
saitama,熊谷市,熊谷市,タイムズ熊谷筑波,36.14057,139.39063
saitama,熊谷市,熊谷市,タイムズ熊谷銀座第４ステーション,36.13938,139.39342
saitama,熊谷市,熊谷市,タイムズ熊谷銀座第６,36.14006,139.39391
saitama,熊谷市,熊谷市,ニットーモール熊谷,36.13852,139.39492
saitama,熊谷市,熊谷市,タイムズカルパステーション,36.13910,139.39533
saitama,三郷市,三郷市,プレイズ三郷中央ステーション,35.82267,139.87867
saitama,三郷市,三郷市,ロイヤルハーモニーＢステーション,35.82062,139.87667
saitama,三郷市,三郷市,ロイヤルハーモニーＡステーション,35.82091,139.87671
saitama,三郷市,三郷市,タイムズ新三郷駅前第３,35.85867,139.87026
saitama,三郷市,三郷市,スマートキッズ三郷ステーション,35.80710,139.86678
saitama,三郷市,三郷市,ＩＫＥＡ新三郷ステーション,35.85637,139.86868
saitama,三郷市,三郷市,タイムズ三郷駅前（埼玉）ステーション,35.84516,139.88649
saitama,三郷市,三郷市,タイムズ三郷第６,35.84902,139.88502
saitama,三郷市,三郷市,タイムズ三郷駅北口ステーション,35.84634,139.88496
saitama,三郷市,三郷市,リーブスコート,35.82625,139.88069
saitama,三郷市,三郷市,リブリ・ジュジュールステーション,35.82516,139.87532
saitama,和光市,和光市,和光市駅北口駐車場,35.78836,139.61377
saitama,和光市,和光市,Ｓｏｎａｒｅ和光,35.79025,139.61707
saitama,和光市,和光市,タイムズ和光第２ステーション,35.78698,139.61265
saitama,和光市,和光市,ジュネスパーキングステーション,35.78569,139.61177
saitama,和光市,和光市,クレセール和光ステーション,35.78526,139.61622
saitama,和光市,和光市,エルヴィーナ新倉ステーション,35.78928,139.61445
saitama,和光市,和光市,タイムズ和光新倉１丁目,35.79187,139.60787
saitama,和光市,和光市,タイムズ和光笹目通りステーション,35.78247,139.62159
saitama,和光市,和光市,ヴィルヌーブ和光,35.78497,139.62444
saitama,蕨市,蕨市,タイムズ蕨中央第１０ステーション,35.82525,139.69027
saitama,蕨市,蕨市,アルファコート蕨３,35.82659,139.68766
saitama,蕨市,蕨市,タイムズ蕨中央３丁目第３ステーション,35.82698,139.68695
saitama,蕨市,蕨市,タイムズ蕨中央４丁目,35.82461,139.68470
saitama,蕨市,蕨市,蕨北町カーシェアステーション,35.82814,139.68134
saitama,蕨市,蕨市,タイムズ西川口西口第２ステーション,35.81630,139.70059
saitama,蕨市,蕨市,タイムズ蕨南町３丁目,35.81796,139.70116
saitama,蕨市,蕨市,タイムズ蕨塚越第５ステーション,35.82791,139.69718
saitama,蕨市,蕨市,タイムズ蕨塚越第６ステーション,35.82848,139.69304
saitama,蕨市,蕨市,タイムズ蕨塚越第４ステーション,35.82692,139.69380
saitama,蕨市,蕨市,ドエルコート北戸田ステーション,35.82877,139.66350
saitama,八潮市,八潮市,八潮５丁目駐車場ステーション,35.80911,139.84136
saitama,八潮市,八潮市,八潮駅北口ｇｒａｎｄｅステーション,35.81059,139.84300
saitama,八潮市,八潮市,ザライブオークレジデンス,35.80905,139.84749
saitama,八潮市,八潮市,メゾン・ド・クラージュ,35.80659,139.84707
saitama,八潮市,八潮市,八潮駅南口Ｋ－ｒｏｏｍｓステーション,35.80748,139.84861
