pref,city,subcity,name,lat,lon
saitama,八潮市,八潮市,メルヴィーユステーション,35.80510,139.84472
saitama,八潮市,八潮市,八潮パークスクエア,35.80758,139.84595
saitama,八潮市,八潮市,ファミリーマート八潮駅南店ステーション,35.80429,139.84281
saitama,八潮市,八潮市,フェリーチェ八潮ステーション,35.80564,139.84040
saitama,八潮市,八潮市,八潮大山パーキングステーション,35.80679,139.84246
saitama,上尾市,上尾市,タイムズ上尾東口第１０,35.97502,139.58803
saitama,上尾市,上尾市,タイムズ上尾東口第１１ステーション,35.97244,139.59163
saitama,上尾市,上尾市,タイムズ北上尾駅前第２ステーション,35.98689,139.57700
saitama,上尾市,上尾市,タイムズ上尾東口第８ステーション,35.97601,139.59201
saitama,上尾市,上尾市,タイムズ上尾東口第１２,35.97390,139.59136
saitama,上尾市,上尾市,上尾東口第８（月極）,35.97606,139.59194
saitama,上尾市,上尾市,タイムズ上尾東口第２ステーション,35.97464,139.58797
saitama,上尾市,上尾市,タイムズ上尾西口第４ステーション,35.97308,139.58576
saitama,上尾市,上尾市,タイムズ北上尾駅前第３ステーション,35.98605,139.57918
saitama,上尾市,上尾市,タイムズ上尾西口第８ステーション,35.97025,139.58718
saitama,上尾市,上尾市,タイムズ上尾西口第３ステーション,35.96985,139.58701
saitama,入間市,入間市,タイムズ武蔵藤沢第３,35.82227,139.40920
saitama,入間市,入間市,タイムズ武蔵藤沢第９ステーション,35.82061,139.41213
saitama,入間市,入間市,タイムズ仏子駅前ステーション,35.83840,139.36037
saitama,入間市,入間市,タイムズ金子駅前,35.81181,139.32995
saitama,入間市,入間市,タイムズグリーンガーデン武蔵藤沢,35.82076,139.41532
saitama,入間市,入間市,タイムズ入間第３ステーション,35.83855,139.38873
saitama,入間市,入間市,タイムズ入間第２ステーション,35.83898,139.38884
saitama,新座市,新座市,タイムズ清瀬駅前第２ステーション,35.77178,139.52250
saitama,新座市,新座市,タイムズ新座新堀ステーション,35.76713,139.51945
saitama,新座市,新座市,タイムズ志木第１１ステーション,35.82189,139.57158
saitama,新座市,新座市,タイムズ志木ステーション,35.82299,139.57570
saitama,新座市,新座市,タイムズ志木駅東口ステーション,35.82215,139.57688
saitama,新座市,新座市,タイムズ栗原交差点ステーション,35.76205,139.55147
saitama,新座市,新座市,新座四季タウン第一ステーション,35.80993,139.56712
saitama,ふじみ野市,ふじみ野市,タイムズトナリエふじみ野,35.85707,139.52411
saitama,ふじみ野市,ふじみ野市,タイムズＬＣモール・うれし野第２,35.85606,139.52191
saitama,ふじみ野市,ふじみ野市,タイムズ上福岡第６ステーション,35.87577,139.51220
saitama,ふじみ野市,ふじみ野市,タイムズ上福岡第４ステーション,35.87568,139.51442
saitama,ふじみ野市,ふじみ野市,タイムズ上福岡第８ステーション,35.87430,139.51389
saitama,ふじみ野市,ふじみ野市,タイムズココネパーキング,35.87292,139.51137
saitama,志木市,志木市,タイムズ志木幸町１丁目ステーション,35.82102,139.56633
saitama,志木市,志木市,タイムズ志木第９ステーション,35.82725,139.57658
saitama,志木市,志木市,志木第９（月極）,35.82729,139.57671
saitama,志木市,志木市,プラウドシティ志木本町ステーション,35.82534,139.57711
saitama,志木市,志木市,タイムズ志木駅東口第２ステーション,35.82378,139.57509
saitama,志木市,志木市,タイムズ志木第１０ステーション,35.82698,139.57506
saitama,志木市,志木市,タイムズ志木第１２ステーション,35.82674,139.57542
saitama,久喜市,久喜市,久喜駅前,36.06695,139.67655
saitama,久喜市,久喜市,ＳＰＳ久喜駅前立体駐車場,36.06695,139.67693
saitama,久喜市,久喜市,タイムズ久喜駅西口第４ステーション,36.06649,139.67469
saitama,久喜市,久喜市,タイムズ久喜駅西口第３ステーション,36.06660,139.67281
saitama,久喜市,久喜市,タイムズ久喜駅東口第５,36.06417,139.68017
saitama,久喜市,久喜市,タイムズ久喜駅東口第２ステーション,36.06661,139.67983
saitama,久喜市,久喜市,タイムズ久喜駅西口第２ステーション,36.06281,139.67438
saitama,久喜市,久喜市,タイムズ鷲宮駅前ステーション,36.09699,139.65734
saitama,富士見市,富士見市,タイムズふじみ野第８ステーション,35.86193,139.52344
saitama,富士見市,富士見市,タイムズふじみ野第３ステーション,35.86062,139.52526
saitama,富士見市,富士見市,クレインコート,35.84415,139.54035
saitama,富士見市,富士見市,タイムズみずほ台第２ステーション,35.83934,139.55022
saitama,富士見市,富士見市,みずほ台新井パーキングステーション,35.83947,139.54942
saitama,富士見市,富士見市,東みずほ台三丁目駐車場,35.84241,139.54968
saitama,富士見市,富士見市,タイムズ鶴瀬第１４ステーション,35.84532,139.54085
saitama,富士見市,富士見市,タイムズ鶴瀬第９ステーション,35.84791,139.53944
saitama,富士見市,富士見市,タイムズ鶴瀬第７,35.84531,139.53607
saitama,富士見市,富士見市,鶴瀬第一マツモトパーキング,35.84210,139.53714
saitama,富士見市,富士見市,タイムズ鶴瀬第１３,35.84444,139.53703
saitama,富士見市,富士見市,タイムズ鶴瀬第１７,35.84669,139.53733
saitama,飯能市,飯能市,タイムズ飯能第１２,35.85284,139.31804
saitama,飯能市,飯能市,タイムズ飯能第９ステーション,35.85248,139.32043
saitama,飯能市,飯能市,タイムズ飯能第５ステーション,35.85209,139.31996
saitama,飯能市,飯能市,タイムズ飯能駅南口第３ステーション,35.85024,139.31813
saitama,飯能市,飯能市,タイムズ飯能駅南口ステーション,35.85021,139.31841
saitama,飯能市,飯能市,タイムズ東飯能駅西口第３,35.85191,139.32441
saitama,飯能市,飯能市,タイムズ飯能第８,35.85279,139.32195
saitama,飯能市,飯能市,タイムズ東飯能第２ステーション,35.85249,139.32794
saitama,飯能市,飯能市,タイムズ飯能第１３,35.85206,139.31544
saitama,鴻巣市,鴻巣市,タイムズ北鴻巣駅西口ステーション,36.08594,139.47560
saitama,鴻巣市,鴻巣市,タイムズ鴻巣本町第７,36.06072,139.51044
saitama,鴻巣市,鴻巣市,タイムズ鴻巣本町第４ステーション,36.05841,139.51236
saitama,鴻巣市,鴻巣市,タイムズ鴻巣本町第３ステーション,36.05833,139.51103
saitama,鴻巣市,鴻巣市,タイムズ鴻巣本町,36.05741,139.51165
saitama,桶川市,桶川市,タイムズ桶川東口第２,35.99851,139.56659
saitama,桶川市,桶川市,タイムズ桶川ステーション,35.99740,139.56444
saitama,桶川市,桶川市,タイムズ桶川（月極）,35.99748,139.56425
saitama,北本市,北本市,タイムズ北本第３ステーション,36.03239,139.53182
saitama,北本市,北本市,タイムズ北本第４ステーション,36.03129,139.53247
saitama,北本市,北本市,タイムズ北本第６ステーション,36.03124,139.53507
saitama,坂戸市,坂戸市,タイムズ坂戸第４ステーション,35.95641,139.39467
saitama,坂戸市,坂戸市,タイムズ坂戸第１０,35.95520,139.39424
saitama,坂戸市,坂戸市,タイムズ坂戸第９,35.95602,139.39511
saitama,坂戸市,坂戸市,タイムズ坂戸第３ステーション,35.95611,139.39509
saitama,坂戸市,坂戸市,タイムズ坂戸第５ステーション,35.95566,139.39392
saitama,坂戸市,坂戸市,タイムズ坂戸第１１,35.95532,139.39347
saitama,坂戸市,坂戸市,タイムズ坂戸第６,35.96065,139.39404
saitama,坂戸市,坂戸市,タイムズ北坂戸駅前ステーション,35.97214,139.39869
saitama,坂戸市,坂戸市,柳沢駐車場ステーション,35.97108,139.39680
saitama,狭山市,狭山市,タイムズ入曽第３,35.83282,139.42609
saitama,狭山市,狭山市,タイムズ狭山富士見ステーション,35.85306,139.41579
saitama,狭山市,狭山市,タイムズ新狭山１丁目,35.88602,139.45589
saitama,狭山市,狭山市,タイムズ新狭山第３ステーション,35.87356,139.43248
saitama,狭山市,狭山市,タイムズ新狭山第５,35.87233,139.43478
saitama,狭山市,狭山市,タイムズ新狭山第４ステーション,35.87239,139.43254
saitama,狭山市,狭山市,タイムズ狭山第６,35.85759,139.41589
saitama,狭山市,狭山市,タイムズ狭山市駅東口ステーション,35.85605,139.41443
saitama,鶴ヶ島市,鶴ヶ島市,タイムズ若葉駅東口ステーション,35.94825,139.41095
saitama,鶴ヶ島市,鶴ヶ島市,ドルミ若葉ステーション,35.94852,139.41057
saitama,鶴ヶ島市,鶴ヶ島市,タイムズ鶴ヶ島富士見ステーション,35.95290,139.41344
saitama,鶴ヶ島市,鶴ヶ島市,タイムズ鶴ヶ島第３,35.92813,139.41525
saitama,吉川市,吉川市,タイムズ吉川駅前第８ステーション,35.87802,139.84233
saitama,吉川市,吉川市,中井月極駐車場,35.87831,139.84316
saitama,秩父市,秩父市,タイムズ秩父駅前駐車場ステーション,35.99941,139.08585
saitama,秩父市,秩父市,西武秩父駅前ステーション,35.98890,139.08329
saitama,本庄市,本庄市,ササイパーキングステーション,36.22241,139.18125
saitama,本庄市,本庄市,タイムズ本庄駅北口第２,36.23656,139.19072
saitama,本庄市,本庄市,タイムズ本庄駅南口第２,36.23605,139.18602
saitama,本庄市,本庄市,タイムズ本庄駅南口第３,36.23430,139.18734
saitama,深谷市,深谷市,タイムズ深谷ステーション,36.19022,139.28357
saitama,深谷市,深谷市,タイムズ深谷第２ステーション,36.19377,139.28354
saitama,蓮田市,蓮田市,蓮田駅田口駐車場,35.98275,139.65015
saitama,蓮田市,蓮田市,タイムズ蓮田本町第２ステーション,35.98188,139.65169
saitama,蓮田市,蓮田市,蓮田駅前カーシェアステーション,35.98066,139.65508
saitama,加須市,加須市,タイムズ加須駅前ステーション,36.12521,139.59600
saitama,加須市,加須市,タイムズ加須駅南口第２,36.12235,139.59644
saitama,東松山市,東松山市,ハイムスイート東松山,36.03505,139.40392
saitama,東松山市,東松山市,タイムズ高坂第２,36.00332,139.39885
saitama,東松山市,東松山市,高坂駅東口,36.00352,139.39775
saitama,幸手市,幸手市,タイムズ幸手駅前ステーション,36.07393,139.71533
saitama,比企郡,比企郡,タイムズ小川町駅前第５,36.05751,139.26069
saitama,比企郡,比企郡,タイムズ小川町駅前第２ステーション,36.05705,139.26051
saitama,比企郡,比企郡,タイムズ小川町駅前第３,36.05483,139.26078
saitama,比企郡,比企郡,タイムズつきのわ駅前,36.04300,139.34442
saitama,秩父郡,秩父郡,タイムズ長瀞駅前ステーション,36.09490,139.11186
saitama,児玉郡,児玉郡,タイムズ神保原駅前ステーション,36.25449,139.14977
saitama,大里郡,大里郡,タイムズ寄居駅南口ステーション,36.11723,139.19448
saitama,白岡市,白岡市,タイムズ新白岡駅西口ステーション,36.03869,139.67074
saitama,白岡市,白岡市,タイムズ白岡駅前第４,36.01897,139.66524
saitama,白岡市,白岡市,タイムズ白岡駅前第３,36.02010,139.66670
